{
  "file_type": "csv",
  "total_rows": 150,
  "total_columns": 6,
  "columns_info": [
    {
      "name": "Id",
      "dtype": "int64",
      "non_null_count": 150,
      "null_count": 0,
      "unique_count": 150,
      "sample_values": [
        1,
        2,
        3,
        4,
        5
      ]
    },
    {
      "name": "SepalLengthCm",
      "dtype": "float64",
      "non_null_count": 150,
      "null_count": 0,
      "unique_count": 35,
      "sample_values": [
        5.1,
        4.9,
        4.7,
        4.6,
        5.0
      ]
    },
    {
      "name": "SepalWidthCm",
      "dtype": "float64",
      "non_null_count": 150,
      "null_count": 0,
      "unique_count": 23,
      "sample_values": [
        3.5,
        3.0,
        3.2,
        3.1,
        3.6
      ]
    },
    {
      "name": "PetalLengthCm",
      "dtype": "float64",
      "non_null_count": 150,
      "null_count": 0,
      "unique_count": 43,
      "sample_values": [
        1.4,
        1.3,
        1.5,
        1.7,
        1.6
      ]
    },
    {
      "name": "PetalWidthCm",
      "dtype": "float64",
      "non_null_count": 150,
      "null_count": 0,
      "unique_count": 22,
      "sample_values": [
        0.2,
        0.4,
        0.3,
        0.1,
        0.5
      ]
    },
    {
      "name": "Species",
      "dtype": "object",
      "non_null_count": 150,
      "null_count": 0,
      "unique_count": 3,
      "sample_values": [
        "Iris-setosa",
        "Iris-versicolor",
        "Iris-virginica"
      ]
    }
  ],
  "sample_rows": [
    {
      "Id": 1,
      "SepalLengthCm": 5.1,
      "SepalWidthCm": 3.5,
      "PetalLengthCm": 1.4,
      "PetalWidthCm": 0.2,
      "Species": "Iris-setosa"
    },
    {
      "Id": 2,
      "SepalLengthCm": 4.9,
      "SepalWidthCm": 3.0,
      "PetalLengthCm": 1.4,
      "PetalWidthCm": 0.2,
      "Species": "Iris-setosa"
    },
    {
      "Id": 3,
      "SepalLengthCm": 4.7,
      "SepalWidthCm": 3.2,
      "PetalLengthCm": 1.3,
      "PetalWidthCm": 0.2,
      "Species": "Iris-setosa"
    },
    {
      "Id": 4,
      "SepalLengthCm": 4.6,
      "SepalWidthCm": 3.1,
      "PetalLengthCm": 1.5,
      "PetalWidthCm": 0.2,
      "Species": "Iris-setosa"
    },
    {
      "Id": 5,
      "SepalLengthCm": 5.0,
      "SepalWidthCm": 3.6,
      "PetalLengthCm": 1.4,
      "PetalWidthCm": 0.2,
      "Species": "Iris-setosa"
    }
  ],
  "ai_summary": "**Dataset Summary**\n\n**Overview**\n\nThe dataset appears to contain information about iris flowers, with a total of 150 rows and 6 columns. The dataset is stored in a CSV file and has a mix of numerical and categorical data.\n\n**Key Characteristics and Patterns**\n\n1. **Id Column**: The Id column is an integer column with unique values ranging from 1 to 150. This suggests that each row represents a unique iris flower.\n2. **Sepal and Petal Measurements**: The SepalLengthCm, SepalWidthCm, PetalLengthCm, and PetalWidthCm columns contain measurements in centimeters. The mean values for these columns are 5.84, 3.05, 3.76, and 1.20, respectively. These values suggest that the dataset contains a mix of small and large iris flowers.\n3. **Species Column**: The Species column contains categorical data with three unique values: \"Iris-setosa\", \"Iris-versicolor\", and \"Iris-virginica\". This suggests that the dataset contains information about different species of iris flowers.\n\n**Data Quality Observations**\n\n1. **Missing Values**: There are no missing values in the dataset, which is a good sign.\n2. **Data Types**: The data types for the columns are consistent with the expected data types (integer for Id, float for measurements, and object for Species).\n3. **Unique Values**: The number of unique values for each column is reasonable, with the exception of the SepalWidthCm column, which has only 23 unique values.\n\n**Potential Use Cases or Analyses**\n\n1. **Classification**: The dataset can be used to train a classification model to predict the species of an iris flower based on its measurements.\n2. **Regression**: The dataset can be used to train a regression model to predict the measurements of an iris flower based on its species.\n3. **Clustering**: The dataset can be used to perform clustering analysis to group iris flowers based on their measurements.\n\n**Notable Insights or Anomalies**\n\n1. **Outliers**: There are no obvious outliers in the dataset, but further analysis may reveal some.\n2. **Correlations**: The dataset may contain correlations between the measurements, which can be explored using correlation analysis.\n3. **Species Distribution**: The dataset may contain an imbalance in the distribution of species, which can affect the performance of classification models.\n\nOverall, the dataset appears to be well-structured and suitable for analysis. However, further exploration is needed to uncover any hidden patterns or insights."
}